ID,Source,Content,Char_Len
151,https://www.youtube.com/watch?v=VlpxWbjnoQk&ab_channel=scambaittv,thank you for calling cancellation Department how may I help you um yeah I'm returning a phone call ah yes this call is abnout your computer service which has gone expired and that's why your account has been charged 400 so you want to cancel it or you want to renew that uh no i want to cancel it okay not okay not at all so if you want to cancel that services and stop the statement what you need to do you need to follow the corporate dismiss so i can help you how to cancel that services and we are going to refund back the money so first of all in order to cancel that you need to fill up this cancellation form on your computer and after that your website so is your computer is on right now i do believe are you in front of your computer,744
152,https://www.youtube.com/watch?v=aosANGN3lAA&ab_channel=scambaittv,thank you for calling how can i help you yeah i'm returning a phone call about my refund yeah this is for the services this call is for the services of your computer so you want to renew the services or you just want to cancel it yeah no i don't want to renew it i didn't know i was paying for it sorry i didn't get you i said no i don't want to renew it i didn't even know i was paying for it okay not a problem sorry so you have to just fill up a cancellation form on your computer i'm going to provide you a cancellation form on the computer now so is your computer on this moment yeah what website do i go to okay not a problem so can you have a look on your keyboard at the left and bottom do you see or there are ctrl control key,735
153,https://www.youtube.com/watch?v=oEjeClSV47A&ab_channel=scambaittv,calling this is how can i help you yeah i'm going about my refund i said you're closing down or something okay you okay huh you want you want to cancel right yes okay are you in front of your computer side is your computer on yes okay so tell me what do you see on the computer my computer screen okay look at the very bottom left hand corner at the very bottom left corner which icon do you see on my computer screen i see a windows start key yes yes yes right beside that right beside that right beside the windows start key do you see type here to search type here to search yes of course uh-huh type here to search in type here to search you have to type,658
154,https://www.youtube.com/watch?v=HJAaJdDMU04&ab_channel=scambaittv,thank you for connecting with the cancellation department how may i assist you yes i had a missed call from this number it said to call for my refund yes sir so right now sir what you want to do do you want your refund or do you want to renew it no i want my refund i didn't know i was paying it all right no problem actually sir right now what happened your computer firewall security and the windows defender has got expired and right now your computer needs to be updated okay so that is the reason we will call you to just confirm you do you want to continue or do you want to cancel it because within one and a half hour your money will be debited from your account okay okay yeah so right now sir for the cancellation are you sitting in front of your computer so we will provide you the refund form yes i'm in front of my computer,836
155,https://www.youtube.com/watch?v=eq-rbjTvNm8&ab_channel=scambaittv,yeah i had a missed call from this number uh yeah so this is a amazon refund department uh you have been uh you you have paid 599 for iphone 11 so we just want to confirm it that have you purchased that iphone no not that I'm aware of that is the reason sir we have been calling you just to check it out that the payment has been done that this is a genuine transaction or not uh for your safety sir you need to go ahead and turn on a computer i am getting your computer connected to our accounts department so if the money has been charged to your account we can refund you the money otherwise we simply cancel the transaction okay okay okay i want you to cancel the transaction yeah first we need to check it out that is the reason we need your computer to be connected to our accounts department okay,803
156,https://www.youtube.com/watch?v=8M_7cd1sXhc&ab_channel=ScammerAllergy, hello hello hi I received this email about Northern LifeLock subscription that is expiring today it's asking me for 249 looks like or something like that I'm I never remember having such a subscription what is going on here who's taking money from my account uh my company sir because uh uh you have our company security software in your computer and this is auto renewal Services that's the reason my company charge uses and sending you this email to inform you like you want to continue this Services or cancel it because if you continue the services so my company charge you every month but I don't remember having having this subscription so who made this subscription on my behalf I don't know sir because uh you're and somebody just using our company website and register online form so I don't know exactly who is person activated,838
157,https://www.youtube.com/watch?v=cpryubbCp78&ab_channel=ScammerAllergy,thank you for calling cancellation Department my name is how can I help you hello I received this email from PayPal saying we're glad to serve you as our registered customer we have the premium Security Services ready for installation and looks like money has come out of my account I'm just calling to see what's going on okay can you confirm me with your invoice number ma'am so I can go ahead and check into my system and help you further sure there's an order ID here it's you receive the email today or tomorrow oh yes yesterday oh tomorrow how can I receive an email tomorrow you guys are Time Travelers I received it today no no okay ma'am so are you nearby your computer right now to cancel it out no do you want me to turn it on yes just turn it on okay,762
158,https://www.youtube.com/watch?v=8lwREQPRTEM&ab_channel=ScammerAllergy,hello and thank you for calling support you're talking to how can I help you hi I had a missed call from this number I'm just returning the call now yeah I guess you were trying to reach out PayPal support we missed your call that is correct yes so I'm wondering why I'm losing money I don't recall having any subscription all right no worries I'll check that out for you for a quick verification could you help me with your email address that you have with PayPal yeah so it's uh all right thank you bear with me,513
159,https://www.youtube.com/watch?v=OwxrgENf954&ab_channel=DanGleeballsScambaiter,now first of all let me introduce myself my name is officer with the badge id i am from the tax audit department of hmrc hm revenue and custom how are you doing today yes uh the nature and the purpose of this call it just to notify you it just to inform you that there has been a legal case filed there has been a lawsuit filed against your name for the hmrc and it's regarding a tax fraud it's regarding the tax evasion so do you have any solicitor or any tax lawyer who can represent you inside the courthouse and your case id number your case id number is  now uh what i'm going to do i'm going to read out the legal affidavit report to you so you will get the better idea and the better information that what is this all about and what is going on under your name,767
160,https://www.youtube.com/watch?v=7hF2EVWyIN4&ab_channel=BeardedBroz,hello hey hello hi there yes this is sorry about that i have to take another call okay not a problem now john you were speaking to one of my uh like one of your  case officer do you remember  did you say yeah that's correct yeah i didn't get her name what's her name no okay yeah okay what seems to be the problem that i had a phone call on my landline he said something about hmrc okay okay so what happened okay so can you just help me out with your postcode and your house number so that i can look into the inline revenue database that why did you receive that phone call like what's your postcode so your house number do you have a house number flat number yeah flat,671
161,https://www.youtube.com/watch?v=2_ZYDZtYcps&ab_channel=SigurdWatt,okay so do you have any criminal lawyer who can represent you inside the courthouse no i don't can you guys do that for me okay so let me explain about your case but i go i need it's my job to notify you these lines are recorded and monitored by hmrc okay that's good to know okay sir yeah that's yeah that's fine okay sir so now first of all i would like to grab a piece of paper and then to write down some import important information about your case okay yeah that sounds good to me all right one second i'm just gonna get a piece of paper and a pen one minute okay sir okay take your time hello are you still there hello yeah i've got i've got a piece of paper and a pen though okay please write down my name my name is,724
162,https://www.youtube.com/watch?v=fan1LyGX70s&ab_channel=PhilippaPeters,straight away and you will get arrested shortly hmrc this is officer how may i help you today i'm sorry i've had a call from you all right miss and did you receive any case id case file number no i didn't okay then in order to pull out your file will you help me out with your name yes it's so I can try to pull out your file absolutely it's and can you spell out your last name yeah it's it's it's okay do you have me yes all right so and what is your postal code it's okay fine all right just stay connected with me let me pull out your file in my system thank you for being on hold yes all right here i got your file in my system and i believe you live,655
163,https://www.youtube.com/watch?v=fG4nl_T-i4g&ab_channel=SteveYoung,hm revenue and customs how may I help you yeah hi I just got an automated message to give you a ring okay can you verify me your name so that I can go ahead and pull out your case file please yeah let me check yeah mr how are you doing today well I was alright until I got this phone call okay understood mr can you grab a piece of paper handy so I can go ahead and give you some information you can write it down yeah go on then ok first of all write down my name my name is last name is my badge ID number yes my badge ID number is okay so why do I need all this for actually the reason behind this call is to inform you that there is a lawsuit is being filed on your name by hm revenue and custom in a tax evasion tax fraud case because you didn't pay your tax properly that's the reason okay and how long has this been going on for ,836
164,https://www.youtube.com/watch?v=KbK5Uu4YcZI&ab_channel=NickOey,give me your name so that I can grab your file yeah my name is mr yes yeah yeah wait for one second and I'll grab your file thank you i have your file in front of me the reason we are trying to contact you is to notify you that a criminal case has been registered against your name oh dear for tax evasion and tax fraud there has also been a warrant out for your arrest so who pays your tax who pays my tax yeah um I pay I pay the tax I'm very worried ma'am are you working for a comapny did you call me ma'am i'm a sir hello hi did you call ma'am sorry are you self-employed you working for a company yes my name is mr I work for um I work for the uh oh oh I'm so distressed I sell t-shirts so when hm revenue and custom has conducted a random re-audit on your tags we found out under section,793
165,https://www.youtube.com/watch?v=iMal_n6ltig&ab_channel=VaughnGeorge,ths is your second attempt to avoid your initial appearance to a County Courthouse in your federal and criminal offense and also there is a non bailable warrant of arrest is issued on your name call our direct line number thank you,231
166,https://www.youtube.com/watch?v=_RSrlkfFAUk&ab_channel=MoneySavingExpert.com,you for your response we would now like to transfer you to a call handler for just a few more questions thank you for calling her majesty's revenue and customs how can I help you is this inland revenue and customs yes and I've got a tax fraud on my name yes can I have your name so I can try and see what's the matter yeah mr mr can you spell your name for me please and what's your postcode and your door number but how do I know your revenue and customs listen I'm not here to prove you I'm from hm revenue and customs or not if you don't believe I certainly hang up the call and inform the police to get you arrested okay oh my god you're going to arrest me yeah no please don't arrest me please ,699
167,https://www.youtube.com/watch?v=Xwfcr-GW1D4&ab_channel=StevenPhillips,thank you for calling hm revenue and customs how can I help you oh well you phoned me you tell me ma'am you must have received an automated call you pressed one yeah perhaps yeah yeah so that's the reason your call has been connected to the hm revenue and customs the we had hm revenue and customs okay yeah yeah it's and your voice is too low to hear properly hello hello hello hello hello did you want my name hello hello hello yeah can you can you speak a little louder hello hello my name is that your first name or your last name that's my first name and what's your last name can you spell it out okay so I have your file in front of me that was quick and to check I'm sharing confidential information to the right person can you confirm it with your postcode number,772
168,https://www.youtube.com/watch?v=9bqTXlkiolI&ab_channel=ZanyZara,hello her majesty revenue and customs this call is to inform you that there is a tax fraud case registered under your name yes you have to press one to get connected to the officer of hmrc yeah if in case you don't press one and your call is not connected to us then the warrant will be issued under your name straight away and you will get arrested shortly your call is very important to us please stay on the line you'll be transferred to the next available agent thank you for calling in a hmrc you're speaking with officer how can i help you hello officer i'm officer  from irs how can i help you okay thank you yes,619
169,https://www.youtube.com/watch?v=kJtwOCpFIgY&ab_channel=ChesterDraws,thank you for calling hmrc you're speaking with how may i help you hi i got um a call um from you um it said push one um and then it cut out do you have a reference id for the same um i don't know as i said i tried calling it back and um it just cut out can you help me with your full name yes it's can you spell your last name yeah okay i would require your date of birth and postcode for the verification purpose yep it's and your postcode sorry did you say you're from hm hmrc yes your call has been connected to calling from hmrc london okay okay what's it what's it what's this about just allow me to pull up all the details on my system so that i i'll be at the better position to tell you like what is the issue all about all right we were trying to re-contact you notify that the criminal case has been registered against your name due to tax fraud and tax evasion,872
170,https://www.youtube.com/watch?v=2x665yFRtEk&ab_channel=MoreKitboga,my name is how can I help you hi david i got an email from you about my um was it mcafee subscriptions okay go ahead okay well i don't i don't really want to pay the 399 i prefer to uh cancel that okay you want to cancel all the services and why you want to cancel it because of the money yeah mostly this is a okay definitely ma'am we will cancel the services and for that we have to remove the services from your computer okay I'm sorry could you speak up a little bit it's a little hard to hear what you just said okay i'm telling you in order to uh cancel other services we have to remove the services from your computer is that okay with you yeah that's fine so are you in front of the computer right now yes okay just do one thing just open up a google all right your google is up hold on okay you're talking about the um the uh internet thing right google chrome or like the website or what do you want yes,913
171,https://www.youtube.com/watch?v=QJV9TibuQiY&ab_channel=MoreKitboga,hello hello my name is  i'm calling from refund department we talked before about your computer i'm sorry say that again i said your computer service was expired now it's auto renew and for that reason our company charge on your checking account 499 do you know what did i just call you a second ago was i just calling you yeah yeah absolutely right sir we talked before about your computer we talked before when did we talk I beg your pardon sir huh i just you just left a message for my phone and i called you and i couldn't hear you and you called me back is that it i do believe sir you have a computer in your home right ma'am maam but yes yeah and we long time ago your subscriber for service for your computer we decided to take your all right so that service was expired now it's auto renew all right and for the reason our company charge on your checking account for 499 so it's already charged from your checking account so this is a confirmation call from our company that you want to renew the service or you want your money back so what you want to do what do i want to do yeah you want your money back or you want to cancel the service,1149
172,https://www.youtube.com/watch?v=AKOBZ7PpQI8&ab_channel=MoreKitboga,hello yes hi i'm calling about my 399 auto debit okay my husband and i this is the cancellation what that was about okay this is the cancellation department of windows when you buy the computer uh you get a free subscription to windows and when you buy the computer you automatically pay 399 for it if you did not use the subscription you can simply get it cancelled and you can get a refund of 399 for it so what would you like to do would you like to pay more 399 to keep using the subscription or would you like to cancel it for a refund i don't i i'll have to ask my husband if he if he bought it i wonder if it was my husband who bought it does it say who purchased the uh uh no it doesn't show that because uh you know uh all the customers of microsoft who are using a computer they are being contacted today about it because today is the renewable date of the service wow that's a lot of work hold on one second let me call my husband okay hold on let me just double check with him but i don't i don't think that we won,1026
173,https://www.youtube.com/watch?v=NFTE5WK_tlc&ab_channel=MoreKitboga,thank you for your call you're speaking with how may I may I assist you this evening hello hello yes i'm not having trouble with hello yes i can hear you miss go ahead hello ma'am you hear me yes yes i can hear you i'm having trouble hello yes i'm here you are having trouble with what you're just so quiet hello let me turn my phone up hold on do you hear me hello uh yes yes now i hear you now now i can hear you all right please give me your callback number first oh well i hear you just fine right now but my callback number okay give me your callback number yes thank you miss yeah now please tell me the exact problem you are facing with your email um okay yes so i'm having quite a few problems with my um my computer really but my i can't access my my emails anymore after i updated my computer my grandson had helped me set up my emails on my computer what do you call it the the mail button and right now i'm i'm not able to to do it after i updated my computer give me your first name what it's your name your name oh my name i thought,1046
174,https://www.youtube.com/watch?v=k4nO9nvHg3E&ab_channel=MoreKitboga,hello hello yeah hi this is i may help you i just missed a call from this number yes we left a message to you about this call to make you aware about the auto renewable service of your computer right now i think that's what it was i think that's what it was that is we called you up to ask you what you like to do do you want to continue that auto renewal upgrade of your service contract with the cost of 399 or you want to cancel that up did you say do i want to cancel it or do i want to cancel it yeah i would i said renew it or cancel it what you like to do i'm waiting for your opinion so i can work for them in regards of that command what you like to do do you want to renew that service or you want to cancel it i would like oh i understand what you're saying i understand what you're saying i would i would like to cancel it whatever it is okay so i believe you are in front of your computer this moment are you no just do one thing grab a piece of paper and pen with yourself and be in front of your computer now let me know once you're in front of your once you're in front of your computer,1102
175,https://www.youtube.com/watch?v=TB6qTmRLipg&ab_channel=MoreKitboga,"hello hello yeah thank you for calling cancellation department this is how may i help you ma'am yes you said your name was what sorry okay yeah i got your i got your voicemail there um about the charge being auto renewed yeah i'll let you know i really don't wanna i really don't wanna i guess pay the four hundred i'm not really sure what what exactly it is you're referring to if you don't mind i'll i'll explain each and everything ma'am you have an antivirus in your computer ma'am the mcafee antivirus and the norton security suit so we are calling you from the anti-virus company so you want to renew the contract the anti-virus or you want to cancel the contract map um yeah i don't want to be charged 399. okay so for the cancellation maam, just be in front of a computer maam so we can ge connected to the cancellation department right now okay once you be in front of a computer just let me know i'm i'm actually sitting in front of it right now i was doing a little bit of work okay ma'am and before that i'd like to confirm that i'm speaking to miss no and the number we can am i correct ma'am you're talking about my number yeah that's my number yeah okay ma'am so you are the person so just open the google chrome first of all ma'am okay and",1255
176,https://www.youtube.com/watch?v=11fGUPtG_UM&ab_channel=MoreKitboga,dear customer this call is in regards for the renewal of your computer services as you are a registered customer so 399.99 will be deducted from your account if you wish to cancel or stop the payments please press one or call us back at our toll free transferring call please hold the line hello hi i got yeah i just got your call about something with my subscription uh yes actually like he was having a software security protection plan for your computer okay before but somehow due to some technical glitch over the server that protection got corrupted okay so in order to reactivate the same plan for your computer you have been charged for 300 and that is the reason like our company called you up to tell you all of this about so you will be aware of it okay um sorry could you repeat that like what are you you're saying that i'm being charged money yeah yes you are being charged money of 300 in order to reactivate the protection plan for your computer the software security plan for your computer okay so that is the reason like you have been charged for this amount and that is why our company called you up to tell you all of this so you will be aware of it okay um i don't i don't want to pay 300 for something on my computer right now so you want me to cancel this yes please okay so if you're going to cancel this ma'am that you will be getting your money back as well back to you three hundred okay,1414
177,https://www.youtube.com/watch?v=yQ2m7dio1vE&ab_channel=MoreKitboga,hello yeah yes hello thank your for connecting with us macafee technical support how can I help you sorry you're gonna have to you for some reason I can't tell what you're saying madam but the subscription of your computer has been expired so you need to hello so you ned to follow our step otherwise you can lose your computer yeah you will lose your computer if you're not going to try to listen to me with what I'm saying that's the reason that we are ringing you today okay okay is this I can't really hear what you're saying i i gosh I don't want to lose my computer alright then hello yes maam I'm here okay so tell me hello tell me yes tell me what's going on tell me what's going on I got your voicemail yes of course I believe that you can so maam do you remember like last time you paid 399 and registered in our company yeah the the uh 21st september yes of course madam but the thing is that maam now the subscription has been expired ,947
178,https://www.youtube.com/watch?v=AKLNNyEchS8&ab_channel=MoreKitboga,thank you for calling paypal support your wait time is two minutes to ensure our best service this call may be monitored or recorded please hold while we connect your call thank you for calling paypal this is how may i help you good morning hi what you said your name was my name is yeah that's right all right nice to meet you could you transfer me over to um you know i guess i don't know which department would be somebody in the uh like financing or billing related department so you're looking someone into the for the billing department yeah wow all right sorry to put something okay so who who are you looking for do you have a name i don't it just says that my membership is set to renew today actually for a protection plan okay so uh how much is that for do you see an amount over there how much is the membership for yeah so did i pay with paypal or something is this an automated message i don't understand well i need to go ahead and check this out you know uh can you help me with your email address yeah it says that my i can check back in my because your account is set to auto renew it will automatically process charge on january 19th if you do not,1166
