ID,Source,Content,Char_Len
179,https://www.youtube.com/watch?v=9pvqNsACgOk&ab_channel=MoreKitboga,hello good morning hello yes but you called me and left a voicemail yes ma'am we have give you the voicemail about the refund do you remember you have made a payment for your computer services and maintenance last time yes i think so do you remember yeah so that is why ma'am you are getting the call now to just claim back your refund because in feature we are not able to give you any more services because our main server has been crashed down and we are getting lot of complaint with all the customers that is why we have decided to refund back their money okay because you all earnings support services any further please to reach us to receive the refund okay so you remember ma'am how much amount you have make a payment last time do you remember that not exactly okay let me check in my server how much you are eligible to get back a refund okay just hold on a moment okay I remember what i was working with somebody with my computer at one point I paid someone to help me with my computer okay so maam just go ahead and turn on the computer so i will send you the refund form on this computer scren,1107
180,https://www.youtube.com/watch?v=dwEEBh8de2s&ab_channel=MoreKitboga,hello hey guys is this amazon hello hello yeah hi ma'am you are speaking with yeah you're speaking with i'm just called amazon my amazon prime how may i help you yeah um yeah i got the voicemail about amazon prime and i didn't really understand it it was like all roboticky you're saying something about my amazon account let me tell you ma'am can i just say i love amazon prime can i just say that is that weird yeah but let me tell you i'm okay like uh we just get a report from okay that have you uh purchased the amazon prime subscription again what like we are gonna be charge you for the amazon pack subscription maam okay because we got a request all right that was the reason he got a voicemail or message mail okay what what are you talking what are you talking about i'm talking about that we got a request that under your name and that's been charged of the amount 299 for the amazon prime subscription okay so is that by you oh the price went up yeah the amazon prime wait how much is it now i thought it was like 100 bucks it's 200 now i'm sorry 299 ma'am oh but i'm a student isn't it supposed to be like cheaper if you're a student,1146
181,https://www.youtube.com/watch?v=pbWHVO7S_u4&ab_channel=MoreKitboga,thank you for calling macafee how can I help you yeah I hello you called me about 399 thing is that right yeah you received a voice recorded call sir yes ok perfect so sir the call was in regards to a refund of 399 basically uh three years back you had gone ahead and opted for a security service for your computer and internet connection and okay it was for five years that you made the payments i'm i'm sorry could you repeat that could you repeat that uh sorry sure yeah i was saying three years back you had gone ahead and made a payment of 399 okay and you had taken a package of five years for your internet security and your computer security now uh basically sir uh we are not being able to provide services anymore it's already been three years but as per the US common law we have to refund you back the whole amount,826
182,https://www.youtube.com/watch?v=hZ8qCyW3mls&ab_channel=MoreKitboga,i'm very good how are you uh well i'm a little bit disappointed you gotta be honest i i got a message saying that you're charging me 399 dollars uh yes actually you are connected with a server you are using our computer services and the services are going to be renewed that's why you receive the message okay i guess what i'm saying is i don't i don't want i i don't want you to charge me 400 i guess okay if you don't want to continue with the services just do one thing just go in the front of your computer i'll guide you how you can disconnect yourself from the system from the server so then you will not be charged anything and if in any case by chance you are charged then you will get the refund of that amount today so uh could you repeat that sorry a little bit hard to understand you i'm saying that just go in the front of your computer disconnect the securities from your end then you will not be charged anything for the securities and if in any case we charge you from your bank account we'll refund you back the same amount which you know you paid for you paid for the security,1094
183,https://www.youtube.com/watch?v=4mEzU2M-XVQ&ab_channel=MoreKitboga,hi I need to speak to the norton department please yeah ma'am this is norton how may I help you sorry what is you name my name is okay do you work for norton yes norton antivirus support okay I got a call uh an email sorry I think from someone named about about my norton subscription being auto renewed okay can you tell me the auto id number or the invoice number um hello it's okay and what is the amount 368 okay ma'am just hold one moment and i will check in the system okay alright yeah i can see over there it's a norton subscription for your pc protection so uh as you told me you you order this subscription say that again it's hard to hear you yeah i just say ,670
184,https://www.youtube.com/watch?v=Pwhzqepj2PM&ab_channel=MoreKitboga,hello no one is available to hello hello hello can you hear me sir yes who is this uh sir this is from microsoft I got a call from your number right now how can I help you oh okay yes I was trying to talk to you but for some reason it uh for some reason you weren't answering me okay no issues sir tell me how can i help you today what is the problem well i i didn't i couldn't quite understand the voicemail because it was a little bit uh how do you say um the robot voice was hard to understand okay but but it said something about 900 not an issue and i i wondered did i win 900 or or are you charging me 900 what's what's the 900 let me tell you sir let me tell you can i have your name please so that i can take it down that would be that would be fine that'd be fine my name my name is right yeah okay sir okay so actually sir that your card is going to be charged with 900 for the auto renewal of the computer security which you got in your computer,956
185,https://www.youtube.com/watch?v=4hUopGCSM6o&ab_channel=MoreKitboga,welcome to amazon you're speaking with how can i help you today yes i i need to talk to somebody about an order that i i don't understand on my email please okay no problem ma'am i'll be happy to help you what i can help you with that ma'am please tell me how can i help you  if you have any problem with an order so i i can hardly understand what you're saying uh ma'am can you hear me fine oh that's a little bit that's a little bit better okay ma'am i'm saying if you have a problem with an order you can ask me about it i can help you with that okay yes well well thank you normally i have to wait on hold it's quite it's quite annoying whenever i have to call in um well it says that there was an order for an apple iphone xr 6 4 gb carrier locked carrier subscription cricket wireless and i already have i already have an iphone i don't need this one all right okay ma'am can you please help me with your email address which is associated with the amazon account i don't i don't use amazon i don't like computers,1018
186,https://www.youtube.com/watch?v=lbWpQ5NeE_c&ab_channel=MoreKitboga,hello yes hi can i please speak with someone from microsoft hello hello hello hello yeah hi can you hear me yes can you hear me yes i can hear you how can i help you i need to open up a support ticket with microsoft okay what is the issue in reference to a blocked computer a blocked computer and when did this happen ma'am may i ask you not 10 minutes ago have you installed any application on your computer installed any products on your device what did you do i don't think so i was just i was just using it uh i i was just using it like i normally do checking my i wanted to make sure that my no problem but one of the checks that i deposited into my account cleared okay i got you no problems i can help you with that may i ask you okay i i i got it may i have your first and the last name please oh is my name uh how do you spell it out if you do not mind me asking that i would apologize for that and the last name is um my maiden name is but okay okay got it just a minute okay uh your phone number is correct sure is thank you so in case if i lose you there's no need to worry i can call you back okay if you lose me by any chance all right,1149
187,https://www.youtube.com/watch?v=18bovtIlrpI&ab_channel=MoreKitboga,uh yes mom how can i help you hi i need to talk to somebody about my subscription please uh yes mom how can i help you in that well i my husband asked me to call you he's at the doctor's today um he he just printed out this email about um to support subscriptions okay um it says 499 and then auto renewed so i'd like to um i'd like to talk to someone about that all right ma'am uh can you please tell me your email address well i don't know which email you sent it to he didn't print out that part just has your email on the phone number okay all right uh right now are you in front of your computer yes as a matter of fact i am okay uh so just have a look at the keyboard at the left hand side bottom of your keyboard can you see there is a windows key where is it ah just look at your keyboard at the left hand side bottom of your keyboard can you see there is a windows key it's having a four boxes or four flags printed on it yes,934
188,https://www.youtube.com/watch?v=0fICIJo3JWs&ab_channel=MoreKitboga,thank you for calling mcafee you're speaking with abel how may i help you uh yeah hello yeah how's yeah hi this is uh this is i'm calling about an email that i received earlier today uh may i know uh what it says sir yeah uh it says um due february 2nd 298.99 uh mcafee incorporated powered by quickbooks we have received your order and it's your orders being auto renewed but uh i don't want this i didn't order this i think there's been some kind of mistake i think there's a mistake am i speaking with it's we're speaking with yes okay there must be an invoice that would be a invoice number would you give me that please uh yeah on the on the email it says please give me a moment i'm gonna check it okay okay thank you  i can see over here that it's an order for mcafee total protection renewal it's a renewal of your previous year's order that's what i'm saying that's what i'm saying uh are you are you not using the software anymore,940
189,https://www.youtube.com/watch?v=e4R2K30Y4yc&ab_channel=MoreKitboga,"with Amazon how can I help you I I need to speak to uh the I guess fraud department Amazon yes ma'am this is Amazon fraud prevention department how can I help you oh wow okay so I I got an email saying there was a 17,500 90 wait oh 1,750 I mean that's still a lot though uh 1,750 order and this is fraud you did not prevent this fraud this is I did not place this order it has a an ugly looking Mouse for a computer I did not do this okay okay ma'am so do one thing first like uh confirm me the order ID okay so I'll be looking forward to this and I'll let you know and I I guess like you're a existing customer of Amazon right what like do you have an account with Amazon I don't I use I use my daughters sometimes but I don't have my own maybe that's okay do you think that's how it happened do one thing like confirm me the order ID of yours okay um okay the order ID it says uh where's the order ID hold on thank you for shopping with us do you see the order id",965
190,https://www.youtube.com/watch?v=_NMJdsS-8xs&ab_channel=MoreKitboga,hello yes hello thanks for calling the customer support this is how can i help you hi i i think there might have been a mistake and i i need to talk to somebody from customer support yes you're talking to the customer support of amazon tell me how can i help you madam it's now a bad time no madam tell me how can i help you oh it sounds like okay well i i got a um i got an email saying that i ordered an iphone 13 pro and but i it's going to wellington florida but i but i don't i didn't i didn't order an iphone and i don't live in florida i see madam we are very sorry for the inconvenience cost to you would you please help me out with the order id number hold on i printed it it says  all right and madam is the when was the last time you remember using your amazon account um i don't think i ever had an amazon i've used my daughter's amazon before but i never made one myself i'm not good i'm not good at the computers okay no problem so right now you're sleeping in front of your computer right now no,1010
191,https://www.youtube.com/watch?v=9KDMvjkI6yo&ab_channel=MoreKitboga,thank you for calling amazon they said  i'm assisting you hey hey listen i i'm calling because i got a email from your associate  i think it says sorry i've always been bad with names uh but anyway it says it says that i i have a several orders for ppe shields about covid something about covid 19 i don't know what the heck this is but i uh i don't think this is i think someone might have been placing orders for doctors or something um but under maybe with my name and now was asking me to pay for it so i don't know if you can okay all right uh so sir could there be a possibility that if you've been uh like you might have given the access to your amazon account to someone else uh i don't i mean i don't even use i don't even use my own amazon i use my i use my daughter-in-laws sometimes okay so i'm not sure i don't know if i it i don't know maybe it was a mistake i just wanted to call and double check because it says that i owe a bunch of money i don't want to get a bill i don't want to get a bill or anything,1021
192,https://www.youtube.com/watch?v=HxTZm8W6uaY&ab_channel=MoreKitboga,thanks for calling support this is how may i help you today uh hey can you sorry i'm sorry to bother you i i need to speak to somebody from the security department the technical security department please uh are you reached to the right person ma'am oh thank you i can help you out with that i was on hold for a while there um okay i i've i made a i made a mistake and i don't i don't i'm not really sure what i did i was i was i was trying to look something up for christmas and i i got this i was looking at my emails trying to figure out if there's going to be if the package is going to arrive on time because i i just found out that my grandkids are going to visit for christmas and i didn't buy them anything this year because normally i i visit them later never mind you don't care about that um so i i i was going on the fedex or whatever page to type in the package to see it to see if it was going to show up and the next thing i know there's this message saying that my computer is blocked well anyways that's when i started blasting and i figured i'd call you oh uh do not do not worry about that make sure that do not turn off your computer okay i just wanted to confirm your name before we go ahead so that i can assist you with that right,1253
193,https://www.youtube.com/watch?v=TKeinCUKbk8&t=134s&ab_channel=MoreKitboga,hello hello yes sir can you hear me yeah can  yeah i think i i just called a second ago uh hello yes can i please talk with the accounting department sir my name is this is the cancellation department of norton how can i help you today oh the cancellation department um is this who i need to talk to to cancel my payment yes yes yes yes right okay right now the present moment do you want to continue with that software you want to cancel it and get your refund back to you oh oh i don't want it um i don't even know what it is to be honest i think this could have been like i might have accidentally it might be yes yes so right now the present moment sir but can you please confirm me the invoice number um let me look for it it says okay now i want you to open up your google chrome browser sir do hello what do you want me to do i just want you to minimize your email and open up your google chrome browser sir oh okay i can do that sorry i think i can do that all right ,975
194,https://www.youtube.com/watch?v=o3aDaW0DI4g&ab_channel=MoreKitboga,thank you for calling support you're speaking with how can i help you hi i'm i'm calling in regards to a little bit of a problem that i'm that i just got on my my computer i don't okay i don't know exactly what it is but but i was browsing the web and it said that access to my pc had been blocked okay not a problem ma'am we have to just diagnose your system and can you tell me one thing ma'am what was the last thing you were doing on a computer when you get the alert well i was trying to get some someone told me about a subscription box for crows called crow pro and i was trying to view their web page okay can you tell me another one thing ma'am they're like did you clicked on any type of link or any type of advertisement well i tried to buy their i tried to buy their two-month subscription plan but then this message appeared not a problem actually this can be an attempt of like in suspicious charges this can be an attempt of breach as well so we'll be just diagnosing your system okay ma'am be online please all right,1032
195,https://www.youtube.com/watch?v=uSgFRq2pY0Q&ab_channel=MoreKitboga,hello yeah hello can you hear me yeah can you hear me all right i'm sorry i uh sorry hello okay yeah i can hear you well it's very hard to hear you right now uh i need to speak to somebody in regards to an order okay what was that all can you tell me a order id number i want you to tell me your order ID your phone isn't really coming through right now i can barely understand what you're saying can you hear me ma'am is it better now you can hear me is it better oh yes now like now i understand what you're saying before it sounded like a walkie-talkie okay uh yeah because it was it was a head a headset yeah i checked so tell me what's your query now off like a herd of turtles huh okay well listen i won't take up your time here uh i know what's getting to be the end of the day but um no problem ma'am i i was going through my emails on the afternoon and i noticed a strange invoice from norton a strange invoice what do you mean by strange strange like i wasn't expecting this i don't think i bought this okay just tell me can you tell me the invoice number so i can see in my data,1089
196,https://www.youtube.com/watch?v=uVYOY0Cg1Q4&ab_channel=MoreKitboga,thanks for getting connected with the norton support team my name is how may i help you hello there how are you i'm doing fine sir how are you great uh so i'm trying to figure out what what's going on with a email it says thanks for using nor norton life lock computer protection plan and it says your subscriptions been renewed and your card has been debited 299.99 so i i didn't i don't think that i used that and there might be kind of a mistake are you familiar with this with this norton plan sir let me inform you yes it is for your anti-virus protection of your computer what is that and you have been renewed norton is an anti-virus software for your computer protection no i mean what is it like an anti-virus like an anti-viral sir go ahead it is a software that protects you from malicious software and ads and it it like protects your computer from all kind of viruses and junk files oh okay it doesn't let you enter it so that you when you search the internet is it good to have that  your computer isn't safe sir it is up to you you already have it uh we have renewed it and an amount of,1101
197,https://www.youtube.com/watch?v=YiCtOoRywOA&ab_channel=MoreKitboga,thanks for calling norton antivirus it's here how can assist you today hi i'm having some problems with my uh i guess norton subscription uh could you just help me out with the invoice number which you have received into your email yeah it is uh you know what i actually don't see oh never mind that's right is what is what I see right there I can see in my system the norton antivirus which was running into your computer the was expired on yesterday and today is the auto renewal date now the reason you have been got this confirmation email from our company so right now you want to enable the service and do you want to cancel it i don't no i don't want to renew it no thank you you want to cancel it right um i'd like yes i'd like to cancel it okay in order to cancel it you need to follow some small procedure from our company and the procedure is you need to pull up online cancellation form and you need to help any device like computer or a laptop so right now i do believe are you sitting in front of your computer or laptop right uh i guess i can yeah are you are you in front of your computer or laptop,1114
198,https://www.youtube.com/watch?v=yL-o3DpMkAM&ab_channel=MoreKitboga,hello hello hello i'm sorry hello yes sir this is how can i help you yeah i got a call from this number about an internet internet thing uh yes yes we are calling you from the internet service provider sir and this is about the internet services which are not responding so can you just tell me like are you in front of the computer right now you're i'm sorry yeah i i can be in front of the what's wrong with uh internet internet so last night we had a technical failure on the main server from which you're getting the internet services so most of the services on your internet line right now not active so it means that you might be losing the internet connection if you do not go ahead and reactivate the services so this is the reason we are calling you and just go ahead and update the services back to normal so is it possible for you to be in front of the computer now it's my internet i've been using my internet all day all right it's not all the services like 60 percent of the services are not responding but there might be a possibility like all your services might get stopped so this is the reason we are calling you,1131
199,https://www.youtube.com/watch?v=X4wK_MB53X4&ab_channel=MoreKitboga,thank you for connecting with norton this is david how can you help me today uh hey david can i can i get connected to anybody who handles um like the accounting i guess it'd be the accounting department uh like we we are from the refund department just go ahead and tell me what happened so that i can help you with what department did you say you were with i didn't catch that we are from the refund department the banking department the banking department okay can you hear me okay all right you are connected with the banking department how can i help you um okay well i i just need somebody to to cancel an order i guess it went what went through for 500 and all right 94 for xfinity actually which is okay actually uh can you can you please confirm your order id can you please confirm your order id number or the invoice number so that i can check on my system uh um all right thank you for confirming the invoice number uh like i can see in my system uh first of all i believe you know that not as a service provider who protects your computer from viruses and malicious files so the services was running on your computer but yesterday the services got expired and it has been auto renewed so that is the reason you have been charged for two years premium subscription plan from norton what's weird is that is the reason you have received the email because we have sent you the confirmation,1398
200,https://www.youtube.com/watch?v=R-rHMQUV_cM&ab_channel=MoreKitboga,thank you for calling Amazon how can I help you hey I need to speak with somebody who works in the accounting department please yes ma'am tell me how can I help you you're talking to from billing team maybe I can maybe I should repeat that I need to talk to somebody can you hear me hello yes I can help you perfectly fine ma'am yourself into the billing team right now how can I help somebody who works in the accounting or customer service department literally anyone who can help me would be fine okay sorry guys yes ma'am sorry that I'm upset I'm really stressed out today no you don't need to be upset ma'am I'm very stressed out just relax ma'am okay relax please well after the accident things haven't been going well just tell me what's the concern okay um there's um sorry about that sorry to hear that yeah well I probably shouldn't tell you about what happened yeah since you asked no that's okay ,908
201,https://www.youtube.com/watch?v=Aslt4DdrMXw&ab_channel=MoreKitboga,this is how can I help you yeah I got a call about you guys shutting down did everything going on or something about my computer having a like software support from you guys is that right correct you've just gotta call about that we are going to be shutting down due to this covid 19 as per the usfda has been instruct that we cannot run the operation at this point of time so we are just trying to be calling out of the people who have our subscription with them we are just trying to go ahead and initiate their refund for their particular subscription amount which you have paid with this covid 19 as we are not able to run our operation at this point of time even we are not sure when we can start again wow as you know the situation so today so you're saying that the FDA actually the FDA is shutting down your your business entirely like yeah because see basically we are working over the virtually we are working for the United Kingdom we're working for you as you're in the united states of America we're working for us in Australia and the European country as well so our service team is usually moving here and there to just give the services to our end customer,1172
